{
  "state_version": "1.0",
  "contract_fingerprint": "3e605a2918f27fe21754b5a1a7a94e6e62b19bc7c592d70684d28f0fc4499135",
  "protected_manifest_fingerprint": "1d1b35893e1bf4f9cb71feada8d6bc6c99fb07c0b05fb37eb16f4c4005d6193a",
  "phase": "AUTONOMOUS_RESEARCH",
  "state_revision": 5,
  "created_at": "2026-09-08T06:51:45.247508Z",
  "updated_at": "2026-09-08T07:26:05.848857Z",
  "active_experiment": {
    "experiment_id": "C001-quick-intermediate",
    "candidate_id": "C001-one-shot",
    "hypothesis_id": "H001-one-shot-behavior",
    "stage": "quick",
    "code_reference": "sha256:594cc68884ce544e939f348b4ac9ee35ff453cff8bee655124c72a14150f71e8:mosfmo/algorithm.py",
    "planned_result": "results/quick/C001-one-shot.json"
  },
  "initial_baseline": {
    "candidate_id": "baseline-mo-sfmo",
    "code_reference": "sha256:e2d68774363bddb9e1ce673333960c5f045b7a839ee9343c1020508ea17f6f1c:research/baselines.py",
    "result_refs": ["results/static/baseline-static-validation.json", "results/smoke/baseline-mo-sfmo.json"],
    "validated": true
  },
  "incumbent": {
    "candidate_id": "baseline-mo-sfmo",
    "code_reference": "sha256:e2d68774363bddb9e1ce673333960c5f045b7a839ee9343c1020508ea17f6f1c:research/baselines.py",
    "result_refs": ["results/static/baseline-static-validation.json", "results/smoke/baseline-mo-sfmo.json"]
  },
  "budget_used": {"objective_vector_evaluations": 240000, "fixed_allowance": 24000, "smoke_stage": 216000, "candidates_evaluated": 1},
  "last_completed_action": "C001 passed the scientific quick accuracy-promotion route but failed the quick efficiency route",
  "next_action": "Run paired initial-incumbent and C001 scientific intermediate evidence on schema stage quick",
  "terminal": null
}
