{
  "state_version": "1.0",
  "contract_fingerprint": "3e605a2918f27fe21754b5a1a7a94e6e62b19bc7c592d70684d28f0fc4499135",
  "protected_manifest_fingerprint": "1d1b35893e1bf4f9cb71feada8d6bc6c99fb07c0b05fb37eb16f4c4005d6193a",
  "phase": "AUTONOMOUS_RESEARCH",
  "state_revision": 3,
  "created_at": "2026-09-08T06:51:45.247508Z",
  "updated_at": "2026-09-08T07:19:07.542599Z",
  "active_experiment": null,
  "initial_baseline": {
    "candidate_id": "baseline-mo-sfmo",
    "code_reference": "sha256:e2d68774363bddb9e1ce673333960c5f045b7a839ee9343c1020508ea17f6f1c:research/baselines.py",
    "result_refs": ["results/static/baseline-static-validation.json"],
    "validated": true
  },
  "incumbent": {
    "candidate_id": "baseline-mo-sfmo",
    "code_reference": "sha256:e2d68774363bddb9e1ce673333960c5f045b7a839ee9343c1020508ea17f6f1c:research/baselines.py",
    "result_refs": ["results/static/baseline-static-validation.json"]
  },
  "budget_used": {"objective_vector_evaluations": 24000, "fixed_allowance": 24000, "candidates_evaluated": 0},
  "last_completed_action": "All ten baseline-validation gates passed and the protected MO-SFMO initial incumbent was recorded",
  "next_action": "Record hypothesis H001 and implement the controlled one-shot behavioral-switching candidate C001",
  "terminal": null
}
