{
  "state_version": "1.0",
  "contract_fingerprint": "3e605a2918f27fe21754b5a1a7a94e6e62b19bc7c592d70684d28f0fc4499135",
  "protected_manifest_fingerprint": "1d1b35893e1bf4f9cb71feada8d6bc6c99fb07c0b05fb37eb16f4c4005d6193a",
  "phase": "BASELINE_VALIDATION",
  "state_revision": 2,
  "created_at": "2026-09-08T06:51:45.247508Z",
  "updated_at": "2026-09-08T07:14:19.151716Z",
  "active_experiment": null,
  "initial_baseline": {
    "candidate_id": "baseline-mo-sfmo",
    "code_reference": "sha256:e2d68774363bddb9e1ce673333960c5f045b7a839ee9343c1020508ea17f6f1c:research/baselines.py",
    "result_refs": [".autoresearch/results/static/baseline-static-validation.json", ".autoresearch/results/smoke/baseline-determinism.json"],
    "validated": false
  },
  "incumbent": {
    "candidate_id": "baseline-mo-sfmo",
    "code_reference": "sha256:e2d68774363bddb9e1ce673333960c5f045b7a839ee9343c1020508ea17f6f1c:research/baselines.py",
    "result_refs": [".autoresearch/results/static/baseline-static-validation.json", ".autoresearch/results/smoke/baseline-determinism.json"]
  },
  "budget_used": {"objective_vector_evaluations": 24000, "fixed_allowance": 24000},
  "last_completed_action": "Built and sealed the active adapter, benchmark evaluator, metrics, six baseline implementations, tests, reference hashes, and checksum snapshot",
  "next_action": "Complete the baseline-validation report and enter AUTONOMOUS_RESEARCH only if all ten validation gates pass",
  "terminal": null
}
